{
 "schema": "demo-replay-v1",
 "status": "measured",
 "source": "real runs: plain Glimmer failed; personal Glimmer (sqlglot LoRA adapter, no lesson in the prompt) under test",
 "task": {
  "id": "sqlglot-2095",
  "repo": "tobymao/sqlglot",
  "label": "Oracle query fails to parse when a column name contains #"
 },
 "runs": [
  {
   "id": "plain",
   "label": "Plain Glimmer",
   "subtitle": "Glimmer, no adapter, no notes",
   "role": "floor",
   "status": "measured",
   "model": "Glimmer",
   "adapter": null,
   "shown_run": 2,
   "runs_solved": 0,
   "runs_total": 2,
   "steps": [
    {
     "step": 1,
     "action": "Find files in the repository root",
     "outcome": "progress",
     "tokens_in": 1503,
     "tokens_out": 72,
     "wall_s": 9.1,
     "mistake_tag": "none",
     "wasted": false,
     "note": null,
     "classifier": null,
     "picker": null
    },
    {
     "step": 2,
     "action": "List the repository root",
     "outcome": "progress",
     "tokens_in": 1769,
     "tokens_out": 48,
     "wall_s": 4.9,
     "mistake_tag": "none",
     "wasted": false,
     "note": null,
     "classifier": null,
     "picker": null
    },
    {
     "step": 3,
     "action": "List sqlglot",
     "outcome": "progress",
     "tokens_in": 2328,
     "tokens_out": 67,
     "wall_s": 7.2,
     "mistake_tag": "none",
     "wasted": false,
     "note": null,
     "classifier": null,
     "picker": null
    },
    {
     "step": 4,
     "action": "List sqlglot/dialects",
     "outcome": "progress",
     "tokens_in": 3025,
     "tokens_out": 81,
     "wall_s": 8.5,
     "mistake_tag": "none",
     "wasted": false,
     "note": null,
     "classifier": null,
     "picker": null
    },
    {
     "step": 5,
     "action": "Read sqlglot/dialects/oracle.py",
     "outcome": "progress",
     "tokens_in": 3716,
     "tokens_out": 65,
     "wall_s": 7.2,
     "mistake_tag": "none",
     "wasted": false,
     "note": null,
     "classifier": null,
     "picker": null
    },
    {
     "step": 6,
     "action": "Search sqlglot/tokens.py",
     "outcome": "progress",
     "tokens_in": 5732,
     "tokens_out": 79,
     "wall_s": 11.8,
     "mistake_tag": "none",
     "wasted": false,
     "note": null,
     "classifier": null,
     "picker": null
    },
    {
     "step": 7,
     "action": "Search sqlglot/parser.py",
     "outcome": "progress",
     "tokens_in": 6172,
     "tokens_out": 88,
     "wall_s": 8.5,
     "mistake_tag": "none",
     "wasted": false,
     "note": null,
     "classifier": null,
     "picker": null
    },
    {
     "step": 8,
     "action": "Search sqlglot/parser.py",
     "outcome": "progress",
     "tokens_in": 7916,
     "tokens_out": 74,
     "wall_s": 10.7,
     "mistake_tag": "none",
     "wasted": false,
     "note": null,
     "classifier": null,
     "picker": null
    },
    {
     "step": 9,
     "action": "Read sqlglot/parser.py lines 4303-4380",
     "outcome": "progress",
     "tokens_in": 9619,
     "tokens_out": 78,
     "wall_s": 10.9,
     "mistake_tag": "none",
     "wasted": false,
     "note": null,
     "classifier": null,
     "picker": null
    },
    {
     "step": 10,
     "action": "Read sqlglot/tokens.py lines 400-500",
     "outcome": "progress",
     "tokens_in": 10463,
     "tokens_out": 78,
     "wall_s": 8.7,
     "mistake_tag": "none",
     "wasted": false,
     "note": null,
     "classifier": null,
     "picker": null
    },
    {
     "step": 11,
     "action": "Read sqlglot/tokens.py lines 600-750",
     "outcome": "progress",
     "tokens_in": 11569,
     "tokens_out": 82,
     "wall_s": 9.7,
     "mistake_tag": "none",
     "wasted": false,
     "note": null,
     "classifier": null,
     "picker": null
    },
    {
     "step": 12,
     "action": "Read sqlglot/tokens.py lines 1000-1100",
     "outcome": "progress",
     "tokens_in": 13276,
     "tokens_out": 73,
     "wall_s": 10.6,
     "mistake_tag": "none",
     "wasted": false,
     "note": null,
     "classifier": null,
     "picker": null
    },
    {
     "step": 13,
     "action": "Read sqlglot/tokens.py lines 700-800",
     "outcome": "progress",
     "tokens_in": 14203,
     "tokens_out": 72,
     "wall_s": 8.5,
     "mistake_tag": "repeated",
     "wasted": true,
     "note": null,
     "classifier": null,
     "picker": null
    },
    {
     "step": 14,
     "action": "Search sqlglot/tokens.py",
     "outcome": "progress",
     "tokens_in": 15147,
     "tokens_out": 68,
     "wall_s": 8.3,
     "mistake_tag": "none",
     "wasted": false,
     "note": null,
     "classifier": null,
     "picker": null
    },
    {
     "step": 15,
     "action": "Read sqlglot/tokens.py lines 1129-1150",
     "outcome": "progress",
     "tokens_in": 15269,
     "tokens_out": 58,
     "wall_s": 5.3,
     "mistake_tag": "none",
     "wasted": false,
     "note": null,
     "classifier": null,
     "picker": null
    },
    {
     "step": 16,
     "action": "Write a scratch script",
     "outcome": "progress",
     "tokens_in": 15546,
     "tokens_out": 255,
     "wall_s": 21.9,
     "mistake_tag": "none",
     "wasted": false,
     "note": null,
     "classifier": null,
     "picker": null
    },
    {
     "step": 17,
     "action": "Write a scratch script",
     "outcome": "progress",
     "tokens_in": 16145,
     "tokens_out": 155,
     "wall_s": 14.0,
     "mistake_tag": "none",
     "wasted": false,
     "note": null,
     "classifier": null,
     "picker": null
    },
    {
     "step": 18,
     "action": "Search sqlglot/dialects/oracle.py",
     "outcome": "progress",
     "tokens_in": 16460,
     "tokens_out": 114,
     "wall_s": 10.1,
     "mistake_tag": "none",
     "wasted": false,
     "note": null,
     "classifier": null,
     "picker": null
    },
    {
     "step": 19,
     "action": "Search the code",
     "outcome": "progress",
     "tokens_in": 16619,
     "tokens_out": 109,
     "wall_s": 9.4,
     "mistake_tag": "none",
     "wasted": false,
     "note": null,
     "classifier": null,
     "picker": null
    },
    {
     "step": 20,
     "action": "Search tests/dialects/test_oracle.py",
     "outcome": "progress",
     "tokens_in": 16761,
     "tokens_out": 57,
     "wall_s": 5.1,
     "mistake_tag": "none",
     "wasted": false,
     "note": null,
     "classifier": null,
     "picker": null
    },
    {
     "step": 21,
     "action": "Find files in tests",
     "outcome": "progress",
     "tokens_in": 16851,
     "tokens_out": 51,
     "wall_s": 4.6,
     "mistake_tag": "none",
     "wasted": false,
     "note": null,
     "classifier": null,
     "picker": null
    },
    {
     "step": 22,
     "action": "Read tests/dialects/test_oracle.py",
     "outcome": "progress",
     "tokens_in": 16944,
     "tokens_out": 50,
     "wall_s": 4.6,
     "mistake_tag": "none",
     "wasted": false,
     "note": null,
     "classifier": null,
     "picker": null
    },
    {
     "step": 23,
     "action": "Read sqlglot/tokens.py lines 1129-1145",
     "outcome": "progress",
     "tokens_in": 18734,
     "tokens_out": 337,
     "wall_s": 32.7,
     "mistake_tag": "repeated",
     "wasted": true,
     "note": null,
     "classifier": null,
     "picker": null
    },
    {
     "step": 24,
     "action": "Search sqlglot/dialects/mysql.py",
     "outcome": "progress",
     "tokens_in": 19241,
     "tokens_out": 185,
     "wall_s": 16.0,
     "mistake_tag": "none",
     "wasted": false,
     "note": null,
     "classifier": null,
     "picker": null
    },
    {
     "step": 25,
     "action": "Search sqlglot/dialects/oracle.py",
     "outcome": "failed",
     "tokens_in": 19488,
     "tokens_out": 102,
     "wall_s": 8.9,
     "mistake_tag": "new",
     "wasted": false,
     "note": null,
     "classifier": null,
     "picker": null
    },
    {
     "step": 26,
     "action": "Write a scratch script",
     "outcome": "progress",
     "tokens_in": 19623,
     "tokens_out": 332,
     "wall_s": 27.7,
     "mistake_tag": "none",
     "wasted": false,
     "note": null,
     "classifier": null,
     "picker": null
    },
    {
     "step": 27,
     "action": "Read sqlglot/tokens.py lines 900-1000",
     "outcome": "progress",
     "tokens_in": 20062,
     "tokens_out": 147,
     "wall_s": 12.7,
     "mistake_tag": "none",
     "wasted": false,
     "note": null,
     "classifier": null,
     "picker": null
    },
    {
     "step": 28,
     "action": "Read sqlglot/tokens.py lines 800-900",
     "outcome": "progress",
     "tokens_in": 20945,
     "tokens_out": 71,
     "wall_s": 8.2,
     "mistake_tag": "none",
     "wasted": false,
     "note": null,
     "classifier": null,
     "picker": null
    },
    {
     "step": 29,
     "action": "Write a scratch script",
     "outcome": "progress",
     "tokens_in": 21806,
     "tokens_out": 209,
     "wall_s": 19.7,
     "mistake_tag": "none",
     "wasted": false,
     "note": null,
     "classifier": null,
     "picker": null
    },
    {
     "step": 30,
     "action": "Read sqlglot/tokens.py lines 850-920",
     "outcome": "progress",
     "tokens_in": 22106,
     "tokens_out": 207,
     "wall_s": 17.9,
     "mistake_tag": "repeated",
     "wasted": true,
     "note": null,
     "classifier": null,
     "picker": null
    },
    {
     "step": 31,
     "action": "Write a scratch script",
     "outcome": "progress",
     "tokens_in": 22907,
     "tokens_out": 287,
     "wall_s": 25.6,
     "mistake_tag": "none",
     "wasted": false,
     "note": null,
     "classifier": null,
     "picker": null
    },
    {
     "step": 32,
     "action": "Search sqlglot/tokens.py",
     "outcome": "progress",
     "tokens_in": 23267,
     "tokens_out": 87,
     "wall_s": 7.7,
     "mistake_tag": "none",
     "wasted": false,
     "note": null,
     "classifier": null,
     "picker": null
    },
    {
     "step": 33,
     "action": "Read sqlglot/tokens.py lines 436-480",
     "outcome": "progress",
     "tokens_in": 23572,
     "tokens_out": 83,
     "wall_s": 7.8,